{
  "$schema": "https://json-schema.org/draft/2020-12/schema",
  "title": "KaraokeParty character",
  "description": "A designer's character brief. Production settings and evidence are generated separately.",
  "type": "object",
  "required": [
    "name",
    "description",
    "height",
    "animations"
  ],
  "additionalProperties": false,
  "properties": {
    "name": {
      "$ref": "#/$defs/text"
    },
    "description": {
      "$ref": "#/$defs/text"
    },
    "id": {
      "type": "string",
      "pattern": "^[a-z0-9]+(?:-[a-z0-9]+)*$"
    },
    "age": {
      "$ref": "#/$defs/text"
    },
    "height": {
      "type": "string",
      "pattern": "^\\s*([1-9][0-9]*)\\s*(?:'|′|ft)\\s*((?:[0-9]|1[01])(?:\\.[0-9]+)?)\\s*(?:\"|″|in)\\s*$",
      "description": "Standing barefoot supporting-heel-to-skull-crown physical height in feet and inches; exclude hair, headwear, footwear and props. Production preserves this anatomical scale across every angle. Example: 5 ft 9 in."
    },
    "build": {
      "$ref": "#/$defs/text"
    },
    "face": {
      "$ref": "#/$defs/text"
    },
    "hair": {
      "$ref": "#/$defs/text"
    },
    "outfit": {
      "$ref": "#/$defs/text"
    },
    "prop": {
      "$ref": "#/$defs/text"
    },
    "personality": {
      "$ref": "#/$defs/text"
    },
    "performance_style": {
      "$ref": "#/$defs/text"
    },
    "location": {
      "$ref": "#/$defs/text",
      "description": "Where this character performs, as prose. Their background plate is drawn from it at 2048x1152, with no character in it, and is shown cropped to the central 12:7 — name what identifies the place, and expect the far left and right edges to be cut. It is never quoted into a render of the character, so it may describe the room freely."
    },
    "detail_level": {
      "type": "integer",
      "minimum": 1,
      "maximum": 10,
      "default": 8,
      "description": "Requested visual detail level. Each integer from 1 (least possible detail) through 10 (Illustrative Realism) selects one pinned single-frame detail reference."
    },
    "animations": {
      "$ref": "#/$defs/animationDescriptions"
    },
    "props": {
      "$ref": "#/$defs/propNames",
      "description": "Props the character holds in the key art and the projection views."
    },
    "palette": {
      "$ref": "#/$defs/textList"
    },
    "recognition_cues": {
      "$ref": "#/$defs/textList"
    },
    "avoid": {
      "$ref": "#/$defs/textList"
    }
  },
  "$defs": {
    "text": {
      "type": "string",
      "minLength": 1,
      "pattern": "\\S"
    },
    "textList": {
      "type": "array",
      "items": {
        "$ref": "#/$defs/text"
      }
    },
    "propNames": {
      "type": "array",
      "description": "Props held here, by name, each a file in props/. Empty hands are an empty list or no list at all.",
      "items": { "type": "string", "pattern": "^[A-Za-z0-9][A-Za-z0-9._-]*$" }
    },
    "animation": {
      "description": "What drives the set: this character's performance intent as prose, or the traced motion sheet that drives it instead. One or the other, never both \u2014 one set has one prompt. A sheet is named, never pathed: the pipeline knows where sheets live, and \"auto\" has one chosen.",
      "oneOf": [
        { "$ref": "#/$defs/text" },
        {
          "type": "object",
          "required": ["intent"],
          "additionalProperties": false,
          "properties": {
            "intent": { "$ref": "#/$defs/text" },
            "props": { "$ref": "#/$defs/propNames" },
            "playback": {
              "enum": ["loop", "pingpong", "once", "one-shot", "oneshot"],
              "description": "How this character's written set repeats. Left out, the set plan in cag/sets.py decides."
            }
          }
        },
        {
          "type": "object",
          "required": ["motion"],
          "additionalProperties": false,
          "properties": {
            "props": { "$ref": "#/$defs/propNames" },
            "motion": {
              "type": "string",
              "pattern": "^[A-Za-z0-9][A-Za-z0-9._-]*$",
              "description": "Name of a traced MotionArtist sheet, e.g. \"zs-loop\", or \"auto\" to have one chosen. The sheet carries its own playback, so a set driven by one does not take a playback here."
            }
          }
        }
      ]
    },
    "animationDescriptions": {
      "type": "object",
      "description": "Every supported animation, each driven by one prompt: this character's performance intent as prose, or the name of a traced motion sheet that drives it instead.",
      "required": ["dance", "sing", "flinch", "guard", "entrance", "victory", "ko"],
      "additionalProperties": false,
      "properties": {
        "dance": { "$ref": "#/$defs/animation" },
        "sing": { "$ref": "#/$defs/animation" },
        "flinch": { "$ref": "#/$defs/animation" },
        "guard": { "$ref": "#/$defs/animation" },
        "entrance": { "$ref": "#/$defs/animation" },
        "victory": { "$ref": "#/$defs/animation" },
        "ko": { "$ref": "#/$defs/animation" }
      }
    }
  }
}
