{
  "id": "babs",
  "name": "Babs",
  "height": "5' 10\"",
  "description": "A dramatic torch-song singer, newly awakened and utterly theatrical, who treats every number like her grand debut.",
  "build": "Tall, slender and rigidly upright with a long neck, squared shoulders and precise, bird-like angular gestures; never slouched, shambling or menacing.",
  "face": "Pale grey-lilac skin, dark dramatic brows, dark lips, and a thin neat stitched seam under the jaw on the character-left side.",
  "hair": "A very tall towering cylindrical mass of black hair rising well above the head, crimped and swept straight up, with two sharp white lightning-bolt streaks running from each temple up the sides of the tower. The tower is taller than her face is long and stays vertical in every view.",
  "outfit": "A long flowing white gown with wide wrapped gauze-like sleeves banded to the wrists, a high gathered neckline, and a skirt falling straight to the floor that hides her feet, cinched at the waist with a narrow pale silver sash. No hat, veil or headwear.",
  "personality": "Composed, regal and a little haughty.",
  "performance_style": "Tall and poised: feet together beneath the gown, chin raised, the character-left hand held out at waist height with fingers spread in a stiff theatrical flourish, and the character-right hand resting open at her side.",
  "location": "A grand theatre gone to ruin: a warped parquet stage floor running to the bottom of the frame with dust and fallen plaster across it, shredded ivory drapes hanging in ribbons at the sides, a cracked plaster proscenium with its gilding flaked away, and an enormous cobwebbed crystal chandelier hanging low and unlit. Cold blue moonlight slants in from a broken window high at one side.",
  "recognition_cues": [
    "a very tall towering cylindrical mass of black hair rising well above the head",
    "two sharp white lightning-bolt streaks running from each temple up the sides of the tower",
    "pale grey-lilac skin",
    "a thin neat stitched seam under the jaw on the character-left side",
    "dark dramatic brows",
    "dark lips",
    "a long white column gown with long wrapped sleeves"
  ],
  "palette": [
    "gown #ECE9E2 / #B3AEA4 / #FFFFFF",
    "sash #A9ADB5 / #6D7079 / #D9DCE1",
    "skin #C9C2CC / #8E8594 / #E6E0E8",
    "hair #1B1A1E / #0B0B0D / #434148",
    "hair streak #E8E6E1 / #B3B0AA / #FFFFFF",
    "stitches #5A5360 / #36313A / #7C7482",
    "lip #3E2238",
    "eye white #EFEDE6",
    "eye dark #1B1A1E"
  ],
  "avoid": [
    "a hair tower that leans, flops, splits or shrinks below the height of her face",
    "loose or shoulder-length hair",
    "streaks in any colour but white",
    "blood, gore, open wounds or bandages that read as injury",
    "a veil, crown or headwear",
    "a hissing, snarling or menacing face",
    "zombie arms held straight out",
    "visible feet, legs or a short hem",
    "any real actor's likeness or any film's makeup design",
    "logos, text or real brands"
  ],
  "animations": {
    "dance": {
      "motion": "shakira-01"
    },
    "sing": {
      "intent": "Grand torch-song vocal loop: raise the chin, extend the free hand outward in a slow dramatic reach, then draw it back into her poised ready stance. The mouth must visibly open and change shape across the loop so she unmistakably reads as singing.",
      "props": [
        "mic"
      ]
    },
    "flinch": "Brief room-sound startle: the head jerks back with a sharp bird-like twitch, the shoulders rise and the character-left hand flies up with fingers spread, then she recomposes herself with a haughty tilt of the chin. No opponent, strike or contact.",
    "guard": "One-shot stage self-protection: turn one shoulder toward the room and draw the wide wrapped sleeve of the character-left arm across the torso like a shield, then hold a stiff, regal finish. Not a combat action.",
    "entrance": "One-shot entrance: glide in with small even steps beneath the gown, pause, turn the head sharply toward the room with the hair tower upright, then unfold into the tall poised ready stance with the character-left hand flourished.",
    "victory": {
      "motion": "emote-02"
    },
    "ko": {
      "motion": "emote-01"
    }
  }
}
